{
  "schema_version": 1,
  "profile": "DEVELOPMENT",
  "stack": "Electron 44.3.0 / embedded Node 24.20.0 / Workflow Kit 1.5.0",
  "checks": [
    {
      "required": false,
      "timeout_ms": 120000,
      "id": "unit",
      "executable": "npm",
      "args": [
        "test"
      ]
    },
    {
      "required": false,
      "timeout_ms": 120000,
      "id": "smoke",
      "executable": "npm",
      "args": [
        "run",
        "smoke"
      ]
    },
    {
      "required": false,
      "timeout_ms": 120000,
      "id": "release-pair",
      "executable": "node",
      "args": [
        "scripts/check-event-runtime-release.mjs"
      ],
      "kind": "installed",
      "evidence": "Project Web Pilot.app, /Applications/Project Web Pilot.app и ~/Downloads/WebPilot-0.6.69: обе упаковки совпадают с исходниками; установленный composer передаёт полный текст через ClipboardEvent.paste в настоящий ProseMirror одной transaction, затем Send без дубля. Live ChatGPT и native Windows отдельно."
    }
  ],
  "budget": {
    "soft_tokens": 16000,
    "hard_tokens": 90000,
    "hard_bytes": 180000
  },
  "documentation": {
    "index": "docs/DOCUMENTATION_INDEX.md",
    "mappings": [
      {
        "code": "src/**",
        "documents": [
          "docs/architecture/ARCHITECTURE.md"
        ]
      },
      {
        "code": "tests/**",
        "documents": [
          "docs/VERIFICATION.md"
        ]
      },
      {
        "code": "package*.json",
        "documents": [
          "docs/architecture/ARCHITECTURE.md"
        ]
      },
      {
        "code": ".gitignore",
        "documents": [
          "docs/architecture/ARCHITECTURE.md"
        ]
      }
    ]
  }
}
